"<ID|readonly|noverify>";"<English>";"<French>";"<Italian>";"<German>";"<Spanish>";"<Russian>";"<Polish>";"<Czech>";"<Turkish>";"<Chinese>";"<Japanese>";"<Portuguese>";"<Vietnamese>";"<Ukrainian>";"<Serbian>";"<Hungarian>";"<Korean>";"<Belarusian>";"<Romanian>";"<TChinese>";"<HChinese>";"<Comments>";"<max_chars>"
"missions/tank_event_in_random_battles_historical/desc";"Ground Vehicle Realistic Battles is a mode that includes both ground vehicles and aviation. Special spawn points are used in this mode, which are accrued for successful actions in a battle and are spent on subsequent respawns on ground vehicles or aircraft. The number of points received at the beginning of the battle allows you to run ground vehicles. Markers are only used to indicate allies. Vehicle characteristics are as close as possible to the real ones. Vehicles of one or more nations may be present in a team, only the battles with two participating nations are possible.";"Ground Vehicle Realistic Battles is a mode that includes both ground vehicles and aviation. Special spawn points are used in this mode, which are accrued for successful actions in a battle and are spent on subsequent respawns on ground vehicles or aircraft. The number of points received at the beginning of the battle allows you to run ground vehicles. Markers are only used to indicate allies. Vehicle characteristics are as close as possible to the real ones. Vehicles of one or more nations may be present in a team, only the battles with two participating nations are possible.";"Ground Vehicle Realistic Battles is a mode that includes both ground vehicles and aviation. Special spawn points are used in this mode, which are accrued for successful actions in a battle and are spent on subsequent respawns on ground vehicles or aircraft. The number of points received at the beginning of the battle allows you to run ground vehicles. Markers are only used to indicate allies. Vehicle characteristics are as close as possible to the real ones. Vehicles of one or more nations may be present in a team, only the battles with two participating nations are possible.";"Ground Vehicle Realistic Battles is a mode that includes both ground vehicles and aviation. Special spawn points are used in this mode, which are accrued for successful actions in a battle and are spent on subsequent respawns on ground vehicles or aircraft. The number of points received at the beginning of the battle allows you to run ground vehicles. Markers are only used to indicate allies. Vehicle characteristics are as close as possible to the real ones. Vehicles of one or more nations may be present in a team, only the battles with two participating nations are possible.";"Ground Vehicle Realistic Battles is a mode that includes both ground vehicles and aviation. Special spawn points are used in this mode, which are accrued for successful actions in a battle and are spent on subsequent respawns on ground vehicles or aircraft. The number of points received at the beginning of the battle allows you to run ground vehicles. Markers are only used to indicate allies. Vehicle characteristics are as close as possible to the real ones. Vehicles of one or more nations may be present in a team, only the battles with two participating nations are possible.";"Танковые реалистичные бои — это режим сражений с участием наземной техники и авиации. В данном режиме используются специальные очки возрождения, которые начисляются за успешные действия в бою и расходуются для последующих возрождений на наземной технике или самолётах. Количество очков, выданное в начале боя, обеспечивает выезд на наземной технике. Маркеры используются только для обозначения союзников. Характеристики техники максимально приближены к реальным. В составах команд может находиться техника одной или нескольких наций, возможны сражения с участием только двух игровых наций.";"Ground Vehicle Realistic Battles is a mode that includes both ground vehicles and aviation. Special spawn points are used in this mode, which are accrued for successful actions in a battle and are spent on subsequent respawns on ground vehicles or aircraft. The number of points received at the beginning of the battle allows you to run ground vehicles. Markers are only used to indicate allies. Vehicle characteristics are as close as possible to the real ones. Vehicles of one or more nations may be present in a team, only the battles with two participating nations are possible.";"Ground Vehicle Realistic Battles is a mode that includes both ground vehicles and aviation. Special spawn points are used in this mode, which are accrued for successful actions in a battle and are spent on subsequent respawns on ground vehicles or aircraft. The number of points received at the beginning of the battle allows you to run ground vehicles. Markers are only used to indicate allies. Vehicle characteristics are as close as possible to the real ones. Vehicles of one or more nations may be present in a team, only the battles with two participating nations are possible.";"Ground Vehicle Realistic Battles is a mode that includes both ground vehicles and aviation. Special spawn points are used in this mode, which are accrued for successful actions in a battle and are spent on subsequent respawns on ground vehicles or aircraft. The number of points received at the beginning of the battle allows you to run ground vehicles. Markers are only used to indicate allies. Vehicle characteristics are as close as possible to the real ones. Vehicles of one or more nations may be present in a team, only the battles with two participating nations are possible.";"Ground Vehicle Realistic Battles is a mode that includes both ground vehicles and aviation. Special spawn points are used in this mode, which are accrued for successful actions in a battle and are spent on subsequent respawns on ground vehicles or aircraft. The number of points received at the beginning of the battle allows you to run ground vehicles. Markers are only used to indicate allies. Vehicle characteristics are as close as possible to the real ones. Vehicles of one or more nations may be present in a team, only the battles with two participating nations are possible.";"Ground Vehicle Realistic Battles is a mode that includes both ground vehicles and aviation. Special spawn points are used in this mode, which are accrued for successful actions in a battle and are spent on subsequent respawns on ground vehicles or aircraft. The number of points received at the beginning of the battle allows you to run ground vehicles. Markers are only used to indicate allies. Vehicle characteristics are as close as possible to the real ones. Vehicles of one or more nations may be present in a team, only the battles with two participating nations are possible.";"Ground Vehicle Realistic Battles is a mode that includes both ground vehicles and aviation. Special spawn points are used in this mode, which are accrued for successful actions in a battle and are spent on subsequent respawns on ground vehicles or aircraft. The number of points received at the beginning of the battle allows you to run ground vehicles. Markers are only used to indicate allies. Vehicle characteristics are as close as possible to the real ones. Vehicles of one or more nations may be present in a team, only the battles with two participating nations are possible.";"Ground Vehicle Realistic Battles is a mode that includes both ground vehicles and aviation. Special spawn points are used in this mode, which are accrued for successful actions in a battle and are spent on subsequent respawns on ground vehicles or aircraft. The number of points received at the beginning of the battle allows you to run ground vehicles. Markers are only used to indicate allies. Vehicle characteristics are as close as possible to the real ones. Vehicles of one or more nations may be present in a team, only the battles with two participating nations are possible.";"Ground Vehicle Realistic Battles is a mode that includes both ground vehicles and aviation. Special spawn points are used in this mode, which are accrued for successful actions in a battle and are spent on subsequent respawns on ground vehicles or aircraft. The number of points received at the beginning of the battle allows you to run ground vehicles. Markers are only used to indicate allies. Vehicle characteristics are as close as possible to the real ones. Vehicles of one or more nations may be present in a team, only the battles with two participating nations are possible.";"Ground Vehicle Realistic Battles is a mode that includes both ground vehicles and aviation. Special spawn points are used in this mode, which are accrued for successful actions in a battle and are spent on subsequent respawns on ground vehicles or aircraft. The number of points received at the beginning of the battle allows you to run ground vehicles. Markers are only used to indicate allies. Vehicle characteristics are as close as possible to the real ones. Vehicles of one or more nations may be present in a team, only the battles with two participating nations are possible.";"Ground Vehicle Realistic Battles is a mode that includes both ground vehicles and aviation. Special spawn points are used in this mode, which are accrued for successful actions in a battle and are spent on subsequent respawns on ground vehicles or aircraft. The number of points received at the beginning of the battle allows you to run ground vehicles. Markers are only used to indicate allies. Vehicle characteristics are as close as possible to the real ones. Vehicles of one or more nations may be present in a team, only the battles with two participating nations are possible.";"Ground Vehicle Realistic Battles is a mode that includes both ground vehicles and aviation. Special spawn points are used in this mode, which are accrued for successful actions in a battle and are spent on subsequent respawns on ground vehicles or aircraft. The number of points received at the beginning of the battle allows you to run ground vehicles. Markers are only used to indicate allies. Vehicle characteristics are as close as possible to the real ones. Vehicles of one or more nations may be present in a team, only the battles with two participating nations are possible.";"Ground Vehicle Realistic Battles is a mode that includes both ground vehicles and aviation. Special spawn points are used in this mode, which are accrued for successful actions in a battle and are spent on subsequent respawns on ground vehicles or aircraft. The number of points received at the beginning of the battle allows you to run ground vehicles. Markers are only used to indicate allies. Vehicle characteristics are as close as possible to the real ones. Vehicles of one or more nations may be present in a team, only the battles with two participating nations are possible.";"Ground Vehicle Realistic Battles is a mode that includes both ground vehicles and aviation. Special spawn points are used in this mode, which are accrued for successful actions in a battle and are spent on subsequent respawns on ground vehicles or aircraft. The number of points received at the beginning of the battle allows you to run ground vehicles. Markers are only used to indicate allies. Vehicle characteristics are as close as possible to the real ones. Vehicles of one or more nations may be present in a team, only the battles with two participating nations are possible.";"Ground Vehicle Realistic Battles is a mode that includes both ground vehicles and aviation. Special spawn points are used in this mode, which are accrued for successful actions in a battle and are spent on subsequent respawns on ground vehicles or aircraft. The number of points received at the beginning of the battle allows you to run ground vehicles. Markers are only used to indicate allies. Vehicle characteristics are as close as possible to the real ones. Vehicles of one or more nations may be present in a team, only the battles with two participating nations are possible.";"Ground Vehicle Realistic Battles is a mode that includes both ground vehicles and aviation. Special spawn points are used in this mode, which are accrued for successful actions in a battle and are spent on subsequent respawns on ground vehicles or aircraft. The number of points received at the beginning of the battle allows you to run ground vehicles. Markers are only used to indicate allies. Vehicle characteristics are as close as possible to the real ones. Vehicles of one or more nations may be present in a team, only the battles with two participating nations are possible.";;
"missions/air_event_historical";"Air Realistic Battles";"Batailles réalistes aériennes";"Battaglie Aeree realistiche";"Realistische Luftschlachten";"Batallas aéreas realistas";"Воздушные реалистичные бои";"Realistyczne Bitwy Powietrzne";"Letecké realistické bitvy";"Gerçekçi Hava Muharebeleri";"空\t战\t \t•\t \t历\t史\t性\t能";"航空\tリアリスティックバトル";"Batalhas Realistas Aéreas";"Air Realistic Battles";"Повітряні реалістичні бої";"Vazdušne realne borbe";"[RB] Realisztikus légi csaták";"리얼리스틱 공중전";"Паветраныя рэалістычныя баі";"Lupte realiste avioane";"空戰歷史性能戰鬥";"空\t战\t \t•\t \t历\t史\t性\t能";;
"missions/tank_event_historical_short";"Ground RB";"Char RB";"Esercito RB";"Land (RB)";"Tanque RB";"Танковые РБ";"Naziemne RB";"Pozemní RB";"Tank GS";"陆\t战\t（\t历\t史\t）";"戦車\tリアリスティックバトル";"RB Tanques";"Ground RB";"Танкові РБ";"Tenkovska RB";"[RB] Szárazföldi";"리얼리스틱 전차전";"Танкавыя РБ";"Tanc LR";"陆战（历史）";"陆\t战\t（\t历\t史\t）";;
"missions/air_event_historical_short";"Air RB";"Air RB";"Aerei RB";"Luft (RB)";"Aéreas RB";"Воздушные РБ";"Powietrzne RB";"Letecká RB";"Hava GM";"空\t战\t（\t历\t史\t）";"航空\tリアリスティックバトル";"RB Aérea";"Air RB";"Повітряні РБ";"Vazdušna RB";"[RB] Repülőgép";"리얼리스틱 공중전";"Паветраныя РБ";"Avioane LR";"空战（历史）";"空\t战\t（\t历\t史\t）";;
"missions/ship_event_historical_short";"Naval RB";"RB Navires";"Navi RB";"Schiffe Realistisch";"Naval RB";"Морские РБ";"Morskie BR";"Naval RB";"Donanma GS";"海\t战\t（\t历\t史\t）";"Naval RB";"Batalha Realista Naval";"Naval RB";"Кораблі РБ";"Naval RB";"[RB] Tengeri";"리얼리스틱 해상전";"Naval RB";"Nave LR";"海戰‧歷史性能";"海\t战\t·\t历\t史\t性\t能";;
"missions/mixed_event_historical";"Mixed Realistic Battles";"Batailles réalistes mixtes";"Battaglie Miste realistiche";"Verbundene Realistische Schlachten";"Batallas realistas mixtas";"Смешанные реалистичные бои";"Realistyczne Bitwy Mieszane";"Smíšené realistické bitvy";"Gerçekçi Karışık Muharebeler";"联\t合\t作\t战\t \t•\t \t历\t史\t性\t能";"混成\tリアリスティックバトル";"Batalhas Realistas Mistas";"Mixed Realistic Battles";"Змішані реалістичні бої";"Mešane realne borbe";"Realisztikus vegyes csaták";"리얼리스틱 합동전";"Агульнавайскавыя рэалістычныя баі";"Lupte realiste mixte";"聯合歷史性能戰鬥";"联\t合\t作\t战\t \t•\t \t历\t史\t性\t能";;
"missions/tank_event_simulator";"Ground Simulator Battles";"Batailles simulateur de chars";"Battaglie Terrestri Simulatore";"Simulator-Panzerschlachten";"Batallas terrestres simulador";"Танковые симуляторные бои";"Symulacyjne Bitwy Pancerne";"Pozemní simulátorové bitvy";"Tank Simülatör Savaşları";"陆\t战\t \t•\t \t全\t真\t模\t拟";"戦車\tシミュレーターバトル";"Batalhas de Simulação de Tanques";"Ground Simulator Battles";"Танкові симуляторні бої";"Tenkovske simulator borbe";"[SB] Szimulátor szárazföldi csaták";"시뮬레이터 전차전";"Сімулятар танкавых баёў";"Lupte simulator tancuri";"陸戰全真模擬戰鬥";"陆\t战\t \t•\t \t全\t真\t模\t拟";;
"missions/tank_event_in_random_battles_simulator";"Ground Simulator Battles";"Ground Simulator Battles";"Ground Simulator Battles";"Ground Simulator Battles";"Ground Simulator Battles";"Танковые симуляторные бои";"Ground Simulator Battles";"Ground Simulator Battles";"Ground Simulator Battles";"Ground Simulator Battles";"Ground Simulator Battles";"Ground Simulator Battles";"Ground Simulator Battles";"Ground Simulator Battles";"Ground Simulator Battles";"Ground Simulator Battles";"Ground Simulator Battles";"Ground Simulator Battles";"Ground Simulator Battles";"Ground Simulator Battles";"Ground Simulator Battles";;
"missions/air_event_simulator";"Air Simulator Battles";"Batailles simulateur aériennes";"Battaglie Aeree simulatore";"Simulator-Luftschlachten";"Batallas aéreas simulador";"Воздушные симуляторные бои";"Symulacyjne Bitwy Powietrzne";"Letecké simulátorové bitvy";"Hava Simülatör Muharebeleri";"空\t战\t \t•\t \t全\t真\t模\t拟";"航空\tシミュレーターバトル";"Batalhas Aéreas de Simulação";"Air Simulator Battles";"Повітряні симуляторні бої";"Vazdušne simulator borbe";"[SB] Szimulátor légi csaták";"시뮬레이터 공중전";"Сімулятар паветраных баёў";"Lupte simulator avioane";"空戰全真模擬戰鬥";"空\t战\t \t•\t \t全\t真\t模\t拟";;
"missions/mixed_event_simulator";"Mixed Simulator Battles";"Batailles simulateur combinées";"Battaglie Miste simulatore";"Verbundene Simulatorschlachten";"Batallas simulador mixtas";"Смешанные симуляторные бои";"Symulacyjne Bitwy Mieszane";"Smíšené simulátorové bitvy";"Karışık Simülatör Muharebeleri";"联\t合\t作\t战\t \t•\t \t全\t真\t模\t拟";"混成\tシミュレーターバトル";"Batalhas Mistas de Simulação";"Mixed Simulator Battles";"Змішані симуляторні бої";"Mešane simulator borbe";"Szimulátor vegyes csaták";"시뮬레이터 합동전";"Сімулятар агульнавайскавых баёў";"Lupte simulator mixte";"聯合全真模擬戰鬥";"联\t合\t作\t战\t \t•\t \t全\t真\t模\t拟";;
"missions/ship_event_arcade";"Naval Arcade Battles";"Batailles navales Arcade";"Battaglie Navali Arcade";"Arcade-Seeschlachten";"Batallas Arcade de Barcos";"Морские аркадные бои";"Zręcznościowe Bitwy Morskie";"Námořní zjednodušené bitvy";"Donanma Basitleştirilmiş Savaşları";"海\t战\t \t•\t \t街\t机\t娱\t乐";"艦艇\tアーケードバトル";"Batalhas de Navios Arcada";"Naval Arcade Battles";"Морські аркадні бої";"Pomorske Arkadne borbe";"[AB] Árkád tengeri csaták";"아케이드 해전";"Марскія аркадныя баі";"Lupte arcade nave";"海戰街機娛樂戰鬥";"海\t战\t \t•\t \t标\t准\t战\t斗";;
