"<ID|readonly|noverify>";"<English>";"<French>";"<Italian>";"<German>";"<Spanish>";"<Russian>";"<Polish>";"<Czech>";"<Turkish>";"<Chinese>";"<Japanese>";"<Portuguese>";"<Ukrainian>";"<Serbian>";"<Hungarian>";"<Korean>";"<Belarusian>";"<Romanian>";"<TChinese>";"<HChinese>";"<Comments>";"<max_chars>"
"mb/us_midway_m4/date";"17:30 June 4, 1942";"17 h 30 – 4 Juin 1942";"17:30 del 4 Giugno 1942";"17:30 Uhr, 4. Juni 1942";"17:30hs, 4 de junio de 1942.";"17:30, 4 июня 1942";"17:30, 4 czerwca 1942 roku";"4. června 1942, 17:30";"17:30 4 Haziran 1942";"1942 年 6 月 4 日，\t17 时 30 分";"1942年\t6月\t4日\t17:30";"4 de Junho de 1942 às 17:30";"17:30, 4 червня 1942 року";"17:30 Jun 4, 1942";"1942. június 4., 17:30";"1942년 6월 4일 17:30";"17:30, 4 чэрвеня 1942 года";"17:30 4 iunie 1942";"1942 年 6 月 4 日，\t17:30";"相\t关\t字\t幕\t内\t容，\t暂\t不\t开\t放\t展\t示";;
"mb/us_midway_m4/objective";"Lead attack group, to participate in an attack on the Japanese naval force";"Menez un groupe d’attaque pour prendre part à une attaque contre les forces navales japonaises";"Conduci il tuo gruppo d'attacco a partecipare all""attacco contro la forza navale giapponese";"Führe deine Angriffsgruppe und nimm an einem Angriff gegen die kaiserlich-japanische Marine teil.";"Lidere el grupo de ataque para sumarse a un ataque a la fuerza naval japonesa";"Возглавьте ударную группу, чтобы принять участие в атаке на японское соединение кораблей.";"Poprowadź grupę bojową do ataku na japońską flotę";"Veď útočnou skupinu do útoku na japonské námořní síly";"Japon donanma gücüne yapılacak saldırıya katılarak saldırı grubunu yönet";"引\t领\t攻\t击\t编\t队\t加\t入\t对\t日\t本\t舰\t队\t的\t空\t袭\t行\t动";"攻撃隊を\t率い、\t日本艦隊への\t攻撃に\t参加せよ";"Levaram um grupo de ataque, para participar de um ataque contra a força naval japonesa";"Очольте ударну групу, щоб долучитися до атаки на японські військово-морські сили";"Predvodi grupu za napad, i učestvuj u napadu na japanske pomorske snage";"Vezesd a köteléked a japán haditengerészeti erők elleni támadásban.";"공격대를 이끌고 일본 해군 공습에 참여하라.";"Узначальце ўдарную групу, каб узяць удзел у атацы на японскае злучэнне караблёў.";"Condu grupul de tac, pentru a participa la un atac asupra forțelor navale japoneze";"領\t導\t攻\t擊\t小\t組，\t加\t入\t對\t日\t本\t海\t軍\t的\t攻\t擊";"相\t关\t字\t幕\t内\t容，\t暂\t不\t开\t放\t展\t示";;
"mb/us_midway_m4/part1";"Despite heavy losses, the morning attack was a success. Three Japanese carriers were destroyed. However, the Japanese command still had Hiryū at its disposal. Planes were launched from its deck to start a counterattack.";"En dépit de lourdes pertes, l'attaque du matin fut un succès. Trois porte-avions japonais furent détruits. Toutefois, le commandement japonais disposait toujours de Hiryu. Des avions s'envolèrent de son pont pour contre-attaquer.";"Nonostante le gravi perdite, l'attacco di questa mattina è stato un successo. Sono state distrutte tre portaerei giapponesi. Tuttavia, il comando giapponese ha ancora la Hiryū a sua disposizione. Dalla sua pista sono decollati degli aerei per cominciare la controffensiva.";"Trotz schwerer Verluste war der morgendliche Angriff ein Erfolg. Drei Flugzeugträger der Japaner wurden zerstört. Doch das japanische Kommando verfügte noch immer über die Hiryū. Flugzeuge wurden von ihrem Deck gestartet, um einen Gegenangriff zu fliegen.";"A pesar de las graves pérdidas, el ataque de la mañana fue un éxito. Se destruyeron tres transportadores japoneses. Sin embargo, el comando japonés todavía tiene al Hiryū a su disposición. Se enviaron aviones desde su cubierta para comenzar el contraataque.";"Несмотря на большие потери, утренняя атака была успешной. Три японских авианосца были уничтожены. Тем не менее, японское командование всё ещё имело в своём распоряжении ""Хирю"". Самолёты, запущенные с его палубы, начали контратаку.";"Pomimo olbrzymich strat poranny atak zakończył się sukcesem. Trzy japońskie lotniskowce zostały zniszczone. Mimo to Japończycy wciąż mieli do dyspozycji lotniskowiec Hiryū. To z jego pokładu miał zostać przeprowadzony kontratak.";"I přes těžké ztráty byl ranní útok úspěšný. Došlo ke zničení tří japonských letadlových lodí. Japonské velení však stále mělo k dispozici Hirjú. Z její paluby vzlétly letouny do protiútoku.";"Ağır kayıplara rağmen sabah saldırısı başarılı oldu. Japon uçak gemileri yok edildi. Ancak Hiryū hâlâ Japonların elindeydi. Güvertesinden karşı saldırı için uçaklar kaldırıldı.";"尽\t管\t损\t失\t惨\t重，\t上\t午\t的\t攻\t击\t还\t是\t成\t功\t了：\t共\t有\t三\t艘\t日\t本\t航\t母\t被\t击\t沉。\t然\t而\t日\t军\t现\t在\t还\t有\t“飞\t龙”\t号。\t此\t时，\t飞\t机\t已\t从\t“飞\t龙”\t号\t甲\t板\t上\t起\t飞\t准\t备\t发\t动\t反\t击。";"多大な\t損害を\t被ったものの、\t朝方の\t攻撃は\t成功し、\t日本軍空母三隻を\t破壊　\tだが\t日本軍には\t空母飛龍が\t残されており、\tその\t飛行甲板から\t攻撃隊が\t発進、\t反撃が\t開始された";"Apesar das perdas, o ataque de manhã foi um sucesso. Três porta-aviões japoneses foram destruídos. No entanto, o comando japonês ainda tinha Hiryū à sua disposição. Os aviões decolaram da sua plataforma para iniciar um contra-ataque.";"Незважаючи на великі втрати, ранкова атака пройшла успішно. Три японські авіаносці було знищено. Однак, японське командування досі має Хірю в своєму розпорядженні. З його палуби було запущено літаки для початку контратаки.";"I pored teških gubitaka, jutarnji napad bio je uspešan. Tri japanska nosača avona su uništena. Međutim, japanska komanda i dalje ima Hirju na raspolaganju. Avioni su poleteli sa njegove palube i započeli kontranapad.";"A súlyos veszteségek ellenére a reggeli támadás sikeres volt. Három japán repülőgép-hordozó megsemmisült, azonban a japán parancsnokságnak még mindig rendelkezésére állt a Hirjú, melynek fedélzetéről ellentámadást indítottak.";"큰 손실에도 불구하고 아침의 공격은 성공했다. 일본군 항공모함 3대가 격침되었다. 그러나 일본에게는 히류가 여전히 남아 있었다. 반격을 시작하기 위해 히류의 갑판에서 항공기들이 출격했다.";"Нягледзячы на вялікія страты, ранішняя атака закончылася паспяхова. Тры японскія авіяносцы былі знішчаныя. І ўсё ж японскае камандаванне ўсё яшчэ мела ў сваім распараджэнні авіяносец «Хір'ю». Самалёты, што ўзляцелі з яго палубы, пачалі контратаку.";"În ciuda pierderilor grele, atacul de dimineață a fost un succes. Trei portavioane japoneze au fost distruse. Cu toate acestea, comandamentul japonez îl mai avea la dispoziție pe Hiryū. Avioanele au fost lansate de pe puntea sa pentru a începe un contraatac.";"管\t損\t失\t慘\t重，\t但\t早\t上\t的\t進\t攻\t還\t是\t取\t得\t了\t成\t功，\t三\t艘\t日\t本\t航\t空\t母\t艦\t被\t摧\t毀，\t但\t是，\t日\t軍\t指\t揮\t部\t仍\t然\t還\t有\t飛\t龍\t號，\t飛\t機\t正\t在\t從\t甲\t板\t上\t起\t飛，\t開\t始\t進\t行\t反\t擊";"相\t关\t字\t幕\t内\t容，\t暂\t不\t开\t放\t展\t示";;
"mb/us_midway_m4/part2";"Both Japanese counter strikes hit the same aircraft carrier. Although Yorktown was dead in the water, both TF-16 carriers remained undamaged.";"Les deux répliques japonaises touchèrent le même porte-avions. Si le Yorktown avait coulé, les deux porte-avions TF-16 n’avaient pas été touchés.";"Entrambi i contrattacchi giapponesi colpirono la stessa portaerei. Nonostante la Yorktown fosse stata abbattuta, entrambe le portaerei TF16 non furono danneggiate.";"Beide japanische Gegenangriffe trafen denselben Flugzeugträger. Obwohl die Yorktown nach dem Angriff manövrier- und kampfunfähig war, blieben die beiden TF16-Träger unbeschädigt.";"Ambos contraataques japoneses impactaron sobre el mismo portaaviones. Si bien el Yorktown ya flotaba muerto en el agua, los dos portaaviones del TF16 no habían sido dañados.";"Оба японских ответных удара пришлись на один авианосец, и хотя ""Йорктаун"" был без хода, оба авианосца TF-16 не были повреждены.";"Oba kontrataki Japończyków zostały wymierzone w ten sam lotniskowiec. Choć Yorktown znalazł się pod wodą, oba lotniskowce z 16 Zespołu Operacyjnego pozostały nieuszkodzone.";"Oba japonské protiútoky se soustředily na stejnou letadlovou loď. Přestože loď Yorktown zůstala nehybně stát, obě letadlové lodi Operačního svazu 16 přežily nepoškozené.";"Japonların iki karşı saldırısı da aynı uçak gemisini vurdu. Yorktown batmış olsa da her iki TF-16 uçak gemisi hasarsız kaldı.";"日\t本\t两\t次\t反\t攻\t阴\t差\t阳\t错\t地\t都\t针\t对\t了\t同\t一\t艘\t航\t母。\t尽\t管\t“约\t克\t城”\t号\t已\t完\t全\t丧\t失\t战\t斗\t力，\t但\t第 16 特\t混\t舰\t队\t的\t两\t艘\t航\t母\t却\t都\t还\t安\t然\t无\t恙。";"日本軍の\t二回に\t渡る\t反撃は\t同じ\t空母に\t集中　\tヨークタウンは\t行動不能となったが、\t第十六任務部隊の\t空母二隻は\t無傷だった";"Ambos os contra ataques, os japoneses deviam atacar os porta-aviões. Apesar de que o  Yorktown foi afundado, bem como os porta-aviões TF-16 permaneceram ilesos.";"Два японські контрудари пошкодили один і той же авіаносець. Хоча Йорктаун потонув, інші два авіаносці TF-16 залишилися неушкодженими.";"Oba japanska kontranapada pogodila su isti nosač aviona. Iako je Jorktaun bio borbeno neupotrebljiv, oba TF - 16 nosača ostala su neoštećena.";"Mindkét japán ellentámadás ugyanazon a repülőgép-hordozót célozta. Annak ellenére, hogy a Yorktown elsüllyedt, a 16. alkalmi harci kötelék mindkét hordozója érintetlen maradt.";"두 차례의 일본군의 반격 모두 같은 항공모함을 공격했다. 비록 요크타운이 수면 위에서 파괴되었지만, TF-16 항공모함 두 척은 모두 손상을 입지 않았다.";"Абодва японскія зваротныя ўдары былі нацэлены на адзін авіяносец. І хоць «Ёрктаўн» быў патоплены, абодва авіяносцы TF-16 заставаліся непашкоджанымі.";"Ambele contraatacuri japoneze au lovit același portavion. Deși Yorktown s-a scufundat, ambele portavioane ale Forței Operaționale 16 au rămas neavariate.";"日\t本\t的\t兩\t次\t反\t擊\t都\t攻\t擊\t了\t同\t一\t艘\t航\t空\t母\t艦，\t儘\t管\t約\t克\t鎮\t號\t已\t經\t沉\t沒，\t但\t第\t16\t特\t遣\t艦\t隊\t的\t兩\t艘\t航\t空\t母\t艦\t都\t沒\t有\t受\t損";"相\t关\t字\t幕\t内\t容，\t暂\t不\t开\t放\t展\t示";;
"mb/us_midway_m4/part3";"While the second wave of the Yorktown attack was heading to Hiryū, Enterprise and Hornet were getting ready to deliver a final blow to the Japanese carrier fleet.";"Alors que la seconde escadre de l’attaque du Yorktown se dirigeait vers le Hiryu, l’Enerprise et le Hornet se préparaient pour l’assaut final de la flotte japonaise.";"Mentre il secondo stormo dell'attacco allaYorktown si stava dirigendo verso la Hiryū, la Enterprise e la Hornet erano pronte a un ultimo attacco contro la flotta di portaerei giapponesi.";"Während der zweiten Angriffswelle, die die Yorktown auf die Hiryū fuhr, bereiteten die Enterprise und die Hornet einen endgültigen Schlag gegen die japanische Flotte vor.";"Mientras la segunda ola del ataque del Yorktown se dirigía hacia Hiryū, el Enterprise y el Hornet se preparaban para propinar una explosión final a la flota de portaaviones japonesa.";"И в момент, когда вторая волна атаки ""Йорктауна"" направлялась назад к ""Хирю"", ""Энтерпрайз"" и ""Хорнет"" готовились нанести решающий удар по японскому флоту авианосцев.";"Podczas gdy druga fala ataku na lotniskowiec Yorktown wracała na Hiryū, lotniskowce Enterprise i Hornet przygotowywały się do zadania ostatecznego ciosu japońskiej flocie.";"Zatímco se druhá vlna útoku na Yorktown vracela na Hirjú, připravovaly se lodě Enterprise a Hornet k uštědření rozhodujícího úderu japonské flotile letadlových lodí.";"Yorktown'ın ikinci saldırısı Hiryū'ya doğru yönelmişken, Enterprise ve Hornet Japon uçak gemisi filosuna son bir darbe vurmaya hazırlanıyordu.";"当\t“约\t克\t城”\t号\t的\t第\t二\t波\t攻\t击\t编\t队\t正\t逼\t近\t“飞\t龙”\t号\t时，\t“企\t业”\t号\t和\t“大\t黄\t蜂”\t号\t则\t已\t准\t备\t好\t对\t日\t本\t航\t母\t舰\t队\t完\t成\t最\t后\t一\t击。";"ヨークタウン\t攻撃の\t第二波が\t飛龍へと\t引き\t返す\t中、\tエンタープライズと\tホーネットは\t日本軍空母に\t止めを\t刺すべく\t準備を\t進めていた";"Enquanto a segunda onda de ataque de  Yorktown estava indo para Hiryū, a Enterprise e a Hornet estavam se preparando para dar um golpe final na frota de porta-aviões japoneses.";"Поки друга хвиля атаки Йорктаун прямувала до Хірю, Ентерпрайз та Хорнет готувалися нанести завершальний удар по японському флоту авіаносців.";"Dok se drugi talas napada sa Jorktauna kretao ka Hirju, Enterprajz i Hornet su se pripremali da zadaju finalni udarac japanskoj floti nosača aviona.";"Miközben a Yorktown ellen indított második hullám gépei már visszatérőben voltak a Hirjú felé, az Enterprise és a Hornet készen állt a japán repülőgép-hordozó flottának megadni az utolsó döfést.";"요크타운의 두 번째 공세가 히류를 향하는 동안, 엔터프라이즈와 호넷은 일본군 항공모함 함대에 최후의 일격을 날릴 준비를 하고 있었다.";"Пакуль другая хваля атакі на «Ёрктаўн» вярталася назад да «Хір'ю», «Энтэрпрайз» і «Хорнэт» рыхтаваліся нанесці вырашальны ўдар па японскім авіяносным флоце.";"În timp ce al doilea val de atac de pe Yorktown se îndrepta spre Hiryū, Enterprise și Hornet se pregăteau să livreze o lovitură finală flotei japoneze de portavioane.";"當\t約\t克\t鎮\t號\t的\t第\t二\t波\t攻\t擊\t即\t將\t前\t往\t飛\t龍\t號\t時，\t企\t業\t號\t和\t大\t黃\t蜂\t號\t則\t已\t經\t準\t備\t好\t對\t日\t本\t航\t空\t母\t艦\t艦\t隊\t進\t行\t最\t後\t一\t擊";"相\t关\t字\t幕\t内\t容，\t暂\t不\t开\t放\t展\t示";;
"mb/us_midway_m4/part4";"After the morning attack against Enterprise, only 24 airplanes were able to strike the enemy.";"Après l’attaque que l’Enterprise avait subie plus tôt, seuls 24 avions étaient en état de frapper l’ennemi.";"Dopo il primo attacco all'Enterprise, solo 24 aerei potevano attaccare il nemico.";"Nach dem morgendlichen Angriff auf die Enterprise waren nur noch 24 Flugzeuge in der Lage, den Feind anzugreifen.";"Después del ataque matinal contra el Enterprise, únicamente quedaron 24 aviones para atacar al enemigo.";"После утренней атаки на ""Энтерпрайз"" только 24 самолёта были доступны для атаки.";"Po wcześniejszym ataku na Enterprise tylko 24 samoloty były w stanie zaatakować wroga.";"Po ranním útoku proti Enterprise bylo pouze 24 letounů schopno zaútočit na nepřítele.";"Enterprise'a yapılan önceki saldırının ardından sadece 24 uçak düşmana saldırabilmişti.";"经\t过\t先\t前\t的\t激\t战，\t“企\t业”\t号\t现\t在\t只\t剩\t下 24 架\t可\t供\t调\t遣\t的\t飞\t机\t了。";"朝、\t空母\tエンタープライズに\t対して\t行われた\t攻撃後、\t敵に\t打撃を\t与え\t得る\t航空機はわずか\t24機であった。";"Depois do ataque de manhã contra a Enterprise, apenas 24 aviões foram capazes de atacar o inimigo.";"Після ранкової атаки на Ентерпрайз, лише 24 літаки були здатні атакувати ворога.";"Nakon jutarnjeg napada na Enterprajz, samo 24 aviona su mogla da izvrše napad na neprijatelja.";"Az Enterprise elleni reggeli támadás után mindössze 24 repülőgép állt rendelkezésre a támadáshoz.";"엔터프라이즈에 대한 아침 공격 후, 24대의 비행기만이 적을 공격할 수 있었다.";"Пасля ранішняй атакі на «Энтэрпрайз» толькі 24 самалёта былі ў стане падняцца ў паветра і атакаваць супраціўніка.";"După atacul de dimineață împotriva lui Enterprise, doar 24 de avioane au reușit să lovească inamicul.";"經\t過\t先\t前\t的\t激\t戰，\t“企\t業”\t號\t現\t在\t只\t剩\t下 24 架\t可\t供\t調\t遣\t的\t飛\t機\t了。";"相\t关\t字\t幕\t内\t容，\t暂\t不\t开\t放\t展\t示";;
"mb/us_midway_m4/part5";"The fighters were left behind to safeguard the fleet, leaving the 24 SBDs to make the run on their own.";"Les chasseurs furent laissés derrière pour protéger la flotte, laissant seuls les 24 SBD se charger de tout.";"I caccia vennero lasciati indietro per coprire la flotta lasciando 24 SBD scoperti per l'azione d'attacco.";"Da die Jäger zum Schutz der Flotte zurückbehalten wurden, mussten die 24 SBDs den Flug ohne Jagdschutz antreten.";"Los cazas se quedaron atrás para salvaguardar la flota, dejando los 24 SBD  hacer la misión por su cuenta.";"Истребители были оставлены на защиту флота, поэтому 24 SBD пришлось лететь без прикрытия.";"Myśliwce zajęły się osłanianiem floty, podczas gdy 24 samoloty SBD same ruszyły na wroga.";"Stíhací letouny byly ponechány na ochranu flotily, takže 24 strojů SBD-3 Dauntless mělo zaútočit samostatně.";"Avcı uçakları donanmayı korumak için geride bırakılmıştı. Saldırıyı 24 SBD tek başına yapacaktı.";"由\t于\t战\t斗\t机\t必\t须\t留\t下\t来\t保\t护\t舰\t队，\t这 24 架 SBD\t“无\t畏”\t只\t能\t自\t食\t其\t力。";"戦闘機は\t艦隊直掩のために\t温存されることとなり、\tそのため\t24機の\tSBDは\t単独で\t攻撃を\t敢行することとなる。";"Os caças permaneceram para proteger a frota, deixando voar os 24 SBDs por conta própria.";"Винищувачі залишилися позаду для захисту флоту, залишивши 24 бомбардувальники SBD без прикриття.";"Lovce su ostavili iza sebe da čuvaju flotu, ostavljajući 24 SBD-a samima.";"A vadászok hátramaradtak védeni a flottát, így a 24 darab SBD kíséret nélkül indult útjára.";"전투기들은 함대를 보호하기 위해 24대의 SBD들이 스스로 임무를 수행하도록 내버려두었다.";"Знішчальнікі засталіся бараніць флот, таму 24-ом SBD давялося ляцець без прыкрыцця.";"Avioanele de vânătoare au rămas în urmă pentru a proteja flota, lăsând cele 24 de avioane SBD să-și urmeze cursul singure.";"戰\t鬥\t機\t被\t留\t下\t來\t保\t護\t艦\t隊，\t只\t剩\t下 24 架\tSBD\t無\t畏\t式\t俯\t衝\t轟\t炸\t機\t自\t行\t飛\t行。";"相\t关\t字\t幕\t内\t容，\t暂\t不\t开\t放\t展\t示";;
"mb/jpn_guadalcanal_m2/place";"IJN Shōkaku, 3rd Fleet, First Carrier Division";"IJN Shokaku, Troisième vaisseau, Première Division de porte-avions";"IJN Shōkaku, 3a Flotta, Prima Divsione Portaerei";"IJN Shōkaku, 3. Flotte, Trägerdivison 1";"IJN Shōkaku, 3era Flota, Primera División de Portaaviones";"Авианосец ""Сёкаку"", Третья Флотилия, Первое Авианосное Подразделение";"Lotniskowiec Shōkaku, 3 Flota, 1 Dywizjon Lotniskowców";"IJN Šókaku, 3. flotila, první divize letadlových lodí";"IJN Shōkaku, 3. Filo, 1. Uçak Gemisi Bölüğü";"日\t本\t第\t三\t舰\t队\t第\t一\t航\t空\t战\t队，\t“翔\t鹤”\t号\t航\t空\t母\t舰";"大日本海軍第\t1機動部隊\t3番艦翔鶴";"MIJ Shōkaku, 3ª Frota, Primeira Frota de Porta-Aviões";"Авіаносець Сьокаку, Третя Флотилія, Перший Авіаносний Дивізіон";"IJN Šokaku, 3. Flota, Prva divizija nosača aviona";"Sókaku repülőgép-hordozó, 3. flotta, 1. repülőgép-hordozó hadosztály";"일본 해군 제1항공함대 제3함대 소속 항공모함 쇼카쿠";"Авіяносец «Сёкаку», Трэцяя флатылія, Першае авіяноснае падраздзяленне";"Shōkaku, MIJ, Flota a treia, Prima divizie de portavioane";"日\t本\t帝\t國\t海\t軍\t五\t航\t戰，\t“翔\t鶴”\t號\t航\t空\t母\t艦";"相\t关\t字\t幕\t内\t容，\t暂\t不\t开\t放\t展\t示";;
"mb/jpn_guadalcanal_m2/date";"15:00 August 24, 1942";"15 h – 24 Août 1942";"15:00:00 del 24.08.42";"15:00 Uhr, 24. August 1942";"15:00hs, 24 de agosto de 1942";"15:00, 24 августа 1942";"15:00, 24 sierpnia 1942 roku";"24. srpna 1942, 15:00";"15:00 24 Ağustos 1942";"1942 年 8 月 24 日，\t15 时 00 分";"1942年\t8月\t24日、\t15:00";"24 de Agosto de 1942 às 15:00";"15:00, 24 серпня 1942 року";"15:00 Avgust 24, 1942";"1942. augusztus 24., 15:00";"1942년 8월 24일 15:00";"15:00, 24 жніўня 1942 года";"15:00 24 august 1942";"1942 年 8 月 24 日，\t15:00";"相\t关\t字\t幕\t内\t容，\t暂\t不\t开\t放\t展\t示";;
"mb/jpn_guadalcanal_m2/objective";"Lead your wing consisting of four A6M2 Zero in an escort mission, to attack on the U.S. carrier fleet";"Menez votre escadrille de 4 Zéros A6M2, en mission d’escorte pour attaquer la flotte de porte-avions américaine";"Conduci il tuo stormo composto da 4 A6M2 Zero, in missione di scorta per attaccare la flotta di portaerei USA";"Führe deinen Schwarm von vier A6M2 Zeros und gib Jagdschutz für den Angriff auf die US-Trägerflotte.";"Lidere a su ala de 4 aviones A6M2 Zero en una misión de escolta para atacar la flota de portaaviones norteamericana";"Возглавьте свой отряд, состоящий из 4 A6M2 Зеро, в эскортной миссии для атаки на авианосный флот США.";"Poprowadź swój klucz składający się z czterech samolotów A6M2 Zero w misji eskortowej, której celem jest zaatakowanie amerykańskiej floty lotniskowców";"Veď svou letku čtyř letounů A6M2 Reisen na doprovodnou misi do útoku na americkou flotilu letadlových lodí";"Dört A6M2 Zeroe'dan oluşan uçuş kolunu, ABD uçak gemisi filosuna saldırı için verilen refakat görevinde yönet";"率\t四\t架\t零\t战\t二\t一\t型\t掩\t护\t己\t方\t轰\t炸\t机\t空\t袭\t美\t军\t航\t母\t舰\t队。";"「A6M2 Zero (零戦)」\t四機編隊を\t率いて\t直掩任務を\t行い、\t米空母艦隊を\t攻撃せよ";"Lideraram sua ala contendo quatro ""A6M2 Zero"" em uma missão de escolta, para atacar a frota de porta-aviões dos Estados Unidos";"Очольте свій загін з чотирьох A6M2 Zero у місії ескорту, для атаки на американський флот авіаносців";"Predvodi leteći odred sastavljen od četiri A6M2 Zeroa u pratećoj misiji, za napad na američku flotu nosača aviona";"Vezesd a négy A6M2 típusú repülőgépből álló köteléked az amerikai repülőgép-hordozó flotta elleni támadásban.";"A6M2 제로센 4대로 구성된 편대를 이끌고 미국 항공모함 함대 공습을 위한 호위 임무에 참가하라.";"Узначальце сваё звяно з чатырох самалётаў A6M2 Zero у місіі суправаджэння для атакі на авіяносны флот ЗША.";"Condu grupul format din patru A6M2 Zero într-o misiune de escortă, pentru a ataca flota de portavioane americane.";"率\t領\t四\t架\t零\t戰\t二\t一\t型\t掩\t護\t友\t軍\t轟\t炸\t機\t空\t襲\t美\t軍\t航\t母\t艦\t隊。";"相\t关\t字\t幕\t内\t容，\t暂\t不\t开\t放\t展\t示";;
