"<ID|readonly|noverify>";"<English>";"<French>";"<Italian>";"<German>";"<Spanish>";"<Russian>";"<Polish>";"<Czech>";"<Turkish>";"<Chinese>";"<Japanese>";"<Portuguese>";"<Ukrainian>";"<Serbian>";"<Hungarian>";"<Korean>";"<Belarusian>";"<Romanian>";"<TChinese>";"<HChinese>";"<Comments>";"<max_chars>"
"mb/us_guadalcanal_m1/part3";"The main goal of the operation was to take Guadalcanal and Florida Islands.";"Le principal objectif de l'opération était de prendre Guadalcanal et les îles Florida.";"L'obbiettivo principale dell'operazione era di prendere Guadalcanal e le Isole Florida.";"Das Hauptziel der Operation war die Eroberung von Guadalcanal und den Florida-Inseln.";"El principal objetivo de la operación era tomar Guadalcanal y las Islas de Florida.";"Основная задача операции заключалась в захвате островов Гуадалканал и Флорида. ";"Głównym celem operacji było zdobycie Guadalcanal i wysp Florida.";"Hlavním cílem operace bylo obsadit ostrovy Guadalcanal a Florida.";"Saldırının ana amacı Guadalcanal ve Florida Adalarını almaktı.";"行\t动\t的\t目\t标\t是\t占\t领\t瓜\t达\t尔\t卡\t纳\t尔\t岛\t和\t佛\t罗\t里\t达\t群\t岛。";"この\t作戦の\t主目標は\tガダルカナルと\tフロリダの\t2島の\t奪取であった。";"O principal objetivo da operação era conquistar o Guadalcanal e as Ilhas Flórida.";"Основною ціллю операції було захоплення островів Гуадалканал та Флорида.";"Glavni cilj operacije bio je zauzimanje Gvadalkanala i Florida ostrva.";"A hadművelet elsődleges célja Guadalcanal és a Florida-sziget elfoglalása volt.";"이 작전의 주요 목표는 과달카날과 플로리다 섬을 점령하는 것이었다.";"Асноўнай задачай аперацыі быў захоп астравоў Гуадалканал і Фларыда. ";"Scopul principal al operațiunii a fost de a lua insulele Guadalcanal și Florida.";"行\t動\t的\t目\t標\t是\t佔\t領\t瓜\t達\t爾\t卡\t納\t爾\t島\t和\t佛\t羅\t里\t達\t群\t島。";"相\t关\t字\t幕\t内\t容，\t暂\t不\t开\t放\t展\t示";;
"mb/us_guadalcanal_m1/part4";"Air forces stationed on the Enterprise, Saratoga and Wasp were to start the operation.";"Les forces aériennes stationnées sur l'Enterprise, le Saratoga et le Wasp allaient démarrer l’opération.";"Le forze aeree che si trovavano sull'Enterprise, la Saratoga e la Waso erano pronte a operare.";"Die Flugzeuge der Enterprise, Saratoga und Wasp sollten die Operation durchführen.";"Las fuerzas aéreas situadas en el Enterprise, Saratoga y Wasp iniciarían la operación.";"Начать операцию предстояло воздушным силам ""Энтерпрайз"", ""Саратога"" и ""Уосп"". ";"Grupy lotnicze lotniskowców Enterprise, Saratoga i Wasp miały rozpocząć operację.";"Operaci měly zahájit letouny na lodích Enterprise, Saratoga a Wasp.";"Enterprise, Saratoga ve Wasp'teki hava kuvvetleri operasyona başlamak üzereydi.";"“企\t业”\t号、\t“萨\t拉\t托\t加”\t号\t和\t“黄\t蜂”\t号\t航\t母\t上\t的\t航\t空\t兵\t准\t备\t开\t始\t行\t动。";"エンタープライズ、\tサラトガ、\tそして\tワスプの\t飛行隊が、\t作戦を\t開始しようとしていた";"As forças aéreas estacionárias da Enterprise, Saratoga e Wasp começavam a operação.";"Повітряні сили, що базувалися на авіаносцях Ентерпрайз, Саратога та Уосп повинні були розпочати операцію.";"Vazdušne snage stacionirane na Enterprajzu, Saratogi i Vospu trebalo je da započnu operaciju.";"A hadművelet megkezdésére készen állt az Enterprise, a Saratoga és a Wasp fedélzetén állomásozó légierő.";"엔터프라이즈와 새러토가, 와스프에 배치된 항공대가 작전을 시작하려 했다.";"Авіягрупы авіяносцаў «Энтэрпрайз», «Саратога» і «Уосп» мелі пачаць аперацыю. ";"Flota aeriană staționată pe Enterprise, Saratoga și Wasp urmau să înceapă operațiunea.";"駐\t紮\t在\t企\t業\t號，\t薩\t拉\t托\t加\t號\t和\t黃\t蜂\t號\t上\t的\t空\t軍\t將\t開\t始\t行\t動";"相\t关\t字\t幕\t内\t容，\t暂\t不\t开\t放\t展\t示";;
"mb/us_guadalcanal_m1/part5";"Their goal was to destroy enemy air force and conduct bombing strikes at strategic points in the operation area.";"Leur objectif était de détruire les forces aériennes ennemies et de bombarder des points stratégiques de la zone.";"Il loro obiettivo era distruggere le forze aeree nemiche e realizzare bombardamenti sui punti strategici dell'area operativa.";"Ihr Ziel war es, die feindliche Luftwaffe zu zerstören und Bomberangriffe auf strategische Ziele im Operationsbereich zu fliegen.";"Su objetivo era el de destruir las fuerzas enemigas y realizar bombardeos en puntos estratégicos del área de operación.";"В их задачу входило уничтожение воздушных сил противника, а также нанесение бомбовых ударов по стратегическим точкам в районе проведения операции.";"Ich zadaniem było zniszczyć wrogie lotnictwo i przeprowadzić ataki bombowe na strategiczne punkty w obszarze operacji.";"Jejich cílem bylo zničit nepřátelské vzdušné síly a provést bombardovací nálety na strategická místa v operační oblasti.";"Amaçları düşman hava kuvvetlerini yok edip operasyon alanındaki stratejik noktalara bombardıman düzenlemekti.";"他\t们\t的\t目\t标\t是\t摧\t毁\t敌\t方\t的\t飞\t行\t部\t队，\t并\t向\t空\t袭\t区\t域\t内\t的\t战\t略\t要\t地。";"彼らの\t任務は、\t敵航空戦力の\t撃滅と、\t作戦地域内の\t戦略拠点を\t爆撃する\t事だった";"Seus objetivos eram destruir a força aérea inimiga e conduzir ataques de bombardeio em pontos estratégicos na área de operação.";"Їхньою метою було знищення ворожих повітряних сил та бомбардування стратегічних пунктів на території проведення операції.";"CIlj im je bio da unište neprijateljske vazdušne snage i sprovedu bombaške napade nad strateškim tačkama u zoni operacije.";"Céljuk az ellenséges légierő megsemmisítése és a hadműveleti terület stratégiai pontjainak lebombázása volt.";"그들의 목표는 적의 항공력을 파괴하고 작전 지역의 전략적 요충지에 폭격을 가하는 것이었다.";"Іх заданнем было знішчэнне паветраных сілаў супраціўніка, а таксама нанясенне бомбавых удараў па стратэгічных пунктах у раёне правядзення аперацыі.";"Scopul acesteia a fost distrugerea flotei aeriene inamice și de a efectua atacuri cu bombardamente la punctele strategice din zona de operațiuni.";"他\t們\t的\t目\t標\t是\t摧\t毀\t敵\t方\t的\t飛\t行\t部\t隊，\t並\t向\t空\t襲\t區\t域\t內\t的\t戰\t略\t要\t地。";"相\t关\t字\t幕\t内\t容，\t暂\t不\t开\t放\t展\t示";;
"mb/us_guadalcanal_m3/place";"Guadalcanal, Henderson Airfield, ""Cactus Air Force""";"Guadalcanal, aérodrome Henderson, « Cactus air force''";"Guadalcanal, Campo d'aviazione Henderson ""Cactus air force""";"Guadalcanal, Henderson Airfield, ''Cactus Air Force''";"Guadalcanal, aeródromo de Henderson, ''Cactus air force''";"Гуадалканал, аэродром Хендерсон, ВВС ""Кактус""";"Guadalcanal, lotnisko Hendersona, Siły Powietrzne „Kaktus”";"Guadalcanal, letiště Henderson Airfield, jednotka „Cactus Air Force“";"Guadalcanal, Henderson Pisti, ""Kaktüs Hava Kuvveti""";"瓜\t达\t尔\t卡\t纳\t尔\t岛，\t亨\t德\t森\t机\t场，\t“仙\t人\t掌\t航\t空\t队”";"ガダルカナル\t島、\tヘンダーソン\t基地、\t「カクタス\t空軍」";"Guadalcanal, aeroporto de Henderson, ""Cactus Air Force""";"Гуадалканал, аеродром Хендерсон, ВПС ""Кактус""";"Gvadalkanal, aerodrom Henderson, ""Cactus Air Force""";"Guadalcanal, Henderson Field repülőtér, Kaktusz légierő";"과달카날, 헨더슨 비행장, ""선인장 공군""";"Гуадалканал, аэрадром Хэндэрсан-Філд, ВПС «Кактус»";"Guadalcanal, Henderson Field, „Forța Aeriană Cactus”";"瓜\t達\t爾\t卡\t納\t爾\t島，\t韓\t德\t森\t機\t場，\t仙\t人\t掌\t空\t軍\t部\t隊";"相\t关\t字\t幕\t内\t容，\t暂\t不\t开\t放\t展\t示";;
"mb/us_guadalcanal_m3/date";"18:00 October 23, 1942";"18 h – 23 Octobre 1942";"18:00:00 del 23.10.42";"18:00 Uhr, 23. Oktober 1942";"18:00hs, 23 de octubre de 1942";"18:00, 23 октября 1942";"18:00, 23 października 1942 roku";"23. října 1942, 18:00";"18:00 23 Ekim 1942";"1942 年 10 月 23 日，\t18 时 00 分";"1942年\t10月\t23日、\t18:00";"23 De Outubro de 1942 às 18:00";"18:00, 23 жовтня 1942 року";"18:00, 23. oktobar 1942.";"1942. október 23., 18:00";"1942년 10월 23일 18:00";"18:00, 23 кастрычніка 1942 года";"18:00 23 octombrie 1942";"1942 年 10 月 23 日，\t18:00";"相\t关\t字\t幕\t内\t容，\t暂\t不\t开\t放\t展\t示";;
"mb/us_guadalcanal_m3/objective";"Lead your wing consisting of four F4F-4, to defend Henderson Field against enemy units";"Menez votre escadrille de 4 F4F-4 pour défendre Henderson contre l’ennemi";"Conduci il tuo stormo composto da 4 F4F-4 a difendere il Campo Henderson contro le unità nemiche";"Führe deine Staffel von vier F4F-4 und verteidige Hendersen Field gegen alle feindlichen Einheiten.";"Lidere a su ala de cuatro aviones F4F-4 para defender a Henderson field de las unidades enemigas";"Возглавьте свой отряд, состоящий из 4 F4F-4, чтобы защитить Хендерсон-Филд от атак вражеских подразделений.";"Poprowadź swój klucz składający się z czterech samolotów F4F-4, aby obronić lotnisko Hendersona przed wrogimi oddziałami";"Veď svou letku čtyř letounů F4F-4 Wildcat k obraně letiště Henderson Field před nepřátelskými jednotkami";"Dört F4F-4'ten oluşan uçuş kolunu, düşman birimlerine karşı Hederson Pisti'ni savunmak için kullan";"率\t四\t架 F4F-4\t“野\t猫”\t保\t卫\t亨\t德\t森\t机\t场。";"「F4F-4」\t四機編隊を\t率い、\tヘンダーソン\t飛行場を\t敵部隊から\t防衛せよ";"Levaram sua ala contendo quatro ""F4F-4"", para defender as unidades inimigas de Henderson Field";"Очольте свій загін з чотирьох F4F-4, щоб захистити Хендерсон Філд від ворожих підрозділів";"Predvodi leteći odred sastavljen od četiri F4F-4, u odbrani aerodroma Henderson od neprijateljskih jedinica";"Vezesd a négy F4F-4 típusú repülőgépből álló köteléked, és védd meg a Henderson Field repülőteret az ellenséges egységektől.";"4대의 F4F-4로 구성된 편대를 이끌고 적군에 맞서 헨더슨 비행장을 지켜라.";"Узначальце сваё звяно з чатырох самалётаў 4 F4F-4, каб абараніць Хэндэрсан-Філд перад атакамі варожых падраздзяленняў.";"Condu grupul format din patru avioane F4F-4, pentru a apăra aerodromul Henderson Field împotriva unităților inamice.";"率\t領\t四\t架 F4F-4 野\t猫\t戰\t鬥\t機，\t防\t守\t亨\t德\t森\t機\t場。";"相\t关\t字\t幕\t内\t容，\t暂\t不\t开\t放\t展\t示";;
"mb/us_guadalcanal_m3/part1";"The Guadalcanal and Tulagi landing was successful. However, it was just the beginning of the confrontation.";"Atterrissage réussi sur Guadalcanal et Tulagi Toutefois, ce n’était que le début de la confrontation.";"L'arrivo a Guadalcanal e Tulagi riuscì. Ma era solo l'inizio dello scontro.";"Die Landungen auf Guadalcanal und Tulagi waren erfolgreich, waren jedoch erst der Anfang der kommenden Kampfhandlungen.";"Los aterrizajes sobre Guadalcanal y Tulagi han sido exitosos. Sin embargo, ese sólo fue el comienzo de la batalla.";"Высадка на Гуадалканале и Тулаги прошла успешно. Однако это было только начало противостояния.";"Lądowanie na Guadalcanal i Tulagi zakończyło się sukcesem. Był to jednak dopiero początek konfrontacji.";"Vylodění na Guadalcanalu a Tulagi bylo úspěšné. Jednalo se však teprve o začátek střetnutí.";"Guadalcanal ve Tulagi inişleri başarılıydı. Ancak bu, çarpışmanın sadece başlangıcıydı.";"美\t军\t成\t功\t占\t领\t了\t瓜\t达\t尔\t卡\t纳\t尔\t岛\t和\t图\t拉\t吉\t岛，\t然\t而\t冲\t突\t还\t远\t未\t结\t束。";"ガダルカナル、\t及び\tツラギへの\t上陸は\t成功　\tだがそれは、\t戦いの\t始まりに\t過ぎなかった";"O Desembarque a Guadalcanal e Tulagi foi um sucesso. No entanto, era somente o começo dos confrontos.";"Висадка на Гуадалканал і Тулагі пройшла успішно. Тим не менш, це був лише початок протистояння.";"Iskrcavanje na Gvadalkanal i na Tulagi bilo je uspešno. Međutim, to je bio samo početak sukoba.";"A guadalcanali és tulagi partraszállás sikeres volt, azonban az ütközet még csak most kezdődött.";"과달카날과 툴라기 상륙은 성공적이었다. 그러나 이것은 대결의 시작에 불과했다.";"Высадка на Гуадалканале і Тулагі завяршылася паспяхова. Аднак гэта быў толькі пачатак супрацьстаяння.";"Debarcarea pe Guadalcanal și Tulagi a avut succes. Totuși, a fost doar începutul confruntării.";"美\t軍\t成\t功\t佔\t領\t了\t瓜\t達\t爾\t卡\t納\t爾\t島\t和\t圖\t拉\t吉\t島，\t然\t而\t衝\t突\t還\t遠\t未\t結\t束。";"相\t关\t字\t幕\t内\t容，\t暂\t不\t开\t放\t展\t示";;
"mb/us_guadalcanal_m3/part2";"In October 1942, Japan moved 15,000 soldiers to Guadalcanal, making it possible to launch an offensive attack.";"En octobre 1942, le Japon installe 15 000 soldats à Guadalcanal, ce qui permet de lancer une attaque offensive.";"Nell'Ottobre del 1942, il Giappone ha dislocato 15.000 soldati presso Guadalcanal, permettegli di lanciare un attacco.";"Im Oktober des Jahres 1942 schickte das Kaiserreich Japan zur Vorbereitung eines Offensivschlags 15.000 weitere Truppen nach Guadalcanal.";"En octubre de 1942, Japón trasladó 15.000 soldados a Guadalcanal, haciendo posible lanzar un ataque ofensivo.";"В октябре 1942 года Япония доставила на Гуадалканал 15 тысяч солдат, сделав возможным ведение наступательных действий.";"W październiku 1942 roku Japonia wysłała 15 000 żołnierzy na Guadalcanal, co umożliwiło rozpoczęcie ofensywy.";"V říjnu 1942 přesunuli Japonci 15 000 vojáků na Guadalcanal, což jim umožnilo zaútočit.";"Ekim 1942'de, olası bir hücum harekatını başlatmak için Japonlar 15000 askeri Guadanlcanal'a gönderdi.";"1942 年 10 月，\t日\t本\t向\t瓜\t达\t尔\t卡\t纳\t尔\t岛\t增\t兵 15,000 名，\t准\t备\t发\t起\t反\t击。";"1942年\t10月、\t日本は\t将兵\t1万\t5千名を\tガダルカナル\t島へ\t移したことで\t攻勢へ\t出ることが\t可能となったのであった。";"Em Outubro de 1942, o Japão moveu 15.000 soldados para Guadalcanal, tornando possível iniciar um ataque ofensivo.";"У жовтні 1942 року, Японія направила 15 000 солдатів до Гуадалканалу, що дозволило розпочати наступальні дії.";"U oktobru 1942, Japan šalje 15.000 vojnika na Gvadalkanal, što im omogućava da započnu sa ofanzivnim napadom.";"1942 októberében Japán 15 000 katonát vezényelt Guadalcanalra, lehetővé téve ezzel egy támadó hadművelet megindítását.";"1942년 10월, 일본군은 과달카날에서 공격을 시작할 수 있게끔 1만 5천명의 병력을 이동시켰다.";"У кастрычніку 1942 г. японцы пераправілі 15 000 жаўнераў на Гуадалканал, што дазволіла ім пачаць маштабнае наступленне.";"În octombrie 1942, Japonia a mutat 15.000 de soldați în Guadalcanal, făcând posibilă lansarea unui atac ofensiv.";"1942 年 10 月，\t日\t本\t向\t瓜\t達\t爾\t卡\t納\t爾\t島\t增\t兵 15,000 名，\t準\t備\t發\t起\t反\t擊。";"相\t关\t字\t幕\t内\t容，\t暂\t不\t开\t放\t展\t示";;
"mb/us_guadalcanal_m3/part3";"The attack targeted Henderson Field, an airport captured by the U.S. forces, as it was the most important strategic point on the island.";"L’attaque visait Henderson, un aéroport pris par les américains car il s’agissait du point stratégique le plus important de l'île.";"L'attacco si diresse a Campo Henderson, un aeroporto conquistato dalle forze USA, perché era il principale punto strategico dell'isola.";"Das Angriffsziel war Henderson Field, ein von den US-Truppen eroberter Flugplatz, da es der wichtigste strategische Punkt der Insel war.";"El ataque estaba dirigido a Henderson Field, un aeropuerto capturado por las fuerzas norteamericanas por tratarse del punto más estratégico de la isla.";"Целью атаки был выбран захваченный американскими войсками аэродром Хендерсон-Филд как наиважнейшая стратегическая точка на острове.";"Szturm skierowany był na lotnisko Hendersona, obiekt kontrolowany przez siły amerykańskie, gdyż był to najważniejszy punkt strategiczny na wyspie.";"Útok cílil na letiště Henderson Field, které měly americké jednotky ve svém držení. Jednalo se o nejdůležitější strategický bod ostrova.";"Saldırının hedefi ABD'nin ele geçirmiş olduğu bir havaalanı olan Henderson Pisti'ydi.";"攻\t击\t目\t标\t是\t已\t被\t美\t军\t占\t领\t的\t亨\t德\t森\t机\t场。\t这\t是\t岛\t上\t最\t重\t要\t的\t战\t略\t点。";"日本軍は、\tアメリカ\t軍に\t制圧された\tヘンダーソン\t飛行場の\t奪還を\t目論んでいた　\tこの\t島における\t最重要戦略拠点である";"O ataque direcionado à Henderson Field, um aeroporto capturado pelas forças dos Estados Unidos, era o mais importante ponto estratégico da ilha.";"Ціль атаки — Хендерсон Філд, аеропорт, захоплений силами США. Найважливіша стратегічна точка острову.";"Napad je za metu imao aerodrom Henderson, aerodrom koji je zarobljen od strane američkih snaga, kako je predstavljao najznačajniju stratešku tačku na ostrvu.";"A támadás célpontja a Henderson Field repülőtér, melyet korábban amerikai csapatok foglaltak el, hiszen ez volt a legfontosabb stratégiai pont a szigeten.";"목표는 미군이 점령한 헨더슨 비행장이었는데, 섬에서 가장 중요한 전략적 요충지였기 때문이다.";"Іх атака была накіравана на заняты амерыканскімі войскамі аэрадром Хэндэрсан-Філд, які з'яўляўся найважнейшым стратэгічным пунктам вострава.";"Atacul a vizat Henderson Field, un aerodrom capturat de forțele americane, fiind cel mai important punct strategic de pe insulă.";"這\t次\t的\t攻\t擊\t目\t標\t是\t韓\t德\t森\t菲\t爾\t德\t機\t場，\t被\t美\t國\t佔\t領\t的\t機\t場，\t這\t是\t島\t上\t最\t重\t要\t的\t戰\t略\t點";"相\t关\t字\t幕\t内\t容，\t暂\t不\t开\t放\t展\t示";;
"mb/us_guadalcanal_m3/part4";"1st Marine Division was in charge of defending the airport.";"La 1ère Division de Marines devait surveiller l’aéroport.";"La 1a Divisione Marina aveva l'incarico di difendere l'aeroporto.";"Die 1. US-Marineinfanteriedivision war mit der Verteidigung des Flugplatzes beauftragt.";"La 1era División de la Marina estaba a cargo de defender el aeropuerto.";"Оборона аэродрома была возложена на Первую дивизию морской пехоты.";"1 Dywizja Piechoty Morskiej miała za zadanie bronić lotniska.";"Obranu letiště měla na starost 1. divize námořní pěchoty.";"Havaalanını savunma görevi 1. Deniz Piyadesi Bölüğü'ndeydi.";"海\t军\t陆\t战\t队\t第\t一\t师\t负\t责\t保\t卫\t机\t场。";"飛行場の\t守備は\t第一海兵師団が\t担当した";"Primeira Divisão de Fuzileiros Navais foi encarregado de defender o aeroporto.";"Перша Морська Дивізія відповідала за захист аеропорту.";"Prva mornarička divizija bila je zadužena za odbranu aerodroma.";"Az első tengerészgyalogos hadosztály volt felelős a repülőtér védelméért.";"미 해병대 제1사단이 비행장 방어의 책임을 맡고 있었다.";"Абараняць аэрадром выпала Першай дывізіі марской пяхоты.";"Prima Divizie a Marinei a fost responsabilă de apărarea aerodromului.";"海\t軍\t陸\t戰\t隊\t第\t一\t師\t負\t責\t保\t衛\t機\t場。";"相\t关\t字\t幕\t内\t容，\t暂\t不\t开\t放\t展\t示";;
"mb/us_guadalcanal_m3/part5";"Japanese forces planned to attack U.S. defenses from three directions, backed by air and artillery support.";"Les Japonais avaient prévus d’attaquer les Américains à partir de trois points, soutenus par les airs et par l’artillerie.";"Le forze giapponesi pensavano di attaccare le difese USA su tre fronti, spalleggiate dal supporto aereo e dall'artiglieria.";"Die japanischen Streitkräfte planten, die US-Abwehrstellungen aus drei Richtungen anzugreifen, unterstützt durch Lufteinheiten und Artillerie.";"Las fuerzas japonesas planeaban atacar a las defensas norteamericanas desde tres direcciones, respaldadas por el apoyo aéreo y de artillería.";"Японские войска планировали провести атаки на укрепления американских войск с трёх сторон при поддержке сил артиллерии и авиации.";"Siły japońskie planowały zaatakować Amerykanów z trzech stron przy wsparciu powietrznym i artyleryjskim.";"Japonci měli v úmyslu na americkou obranu udeřit ze tří stran s podporou vzdušných sil a dělostřelectva.";"Japon kuvvetleri ABD savunmasına üç yönden saldırmayı planladı. Hava ve ağır silah desteği de olacaktı.";"日\t军\t计\t划\t在\t空\t中\t部\t队\t与\t火\t炮\t的\t支\t援\t下，\t从\t三\t个\t方\t向\t攻\t破\t美\t军\t防\t御。";"日本軍は、\tアメリカ\t軍に\t対し\t三方向からの\t攻撃を\t計画　\t航空支援と\t砲撃支援がそれを\t後押しした";"As forças japonesas planejavam atacar as defesas dos Estados Unidos em três direções, tanto aéreo quanto pela artilharia.";"Японські сили планували атакувати американський захист з трьох напрямків, будучи під прикриттям повітряних сил та артилерії.";"Japanske snage planirale su napad na američku odbranu iz tri pravca, sa pomoći iz vazduha i artiljerijom.";"A japán erők légi és tüzérségi támogatás mellett három irányból tervezték megtámadni az amerikai védelmet.";"일본군은 공중 지원과 포병 지원을 받으며 미군의 방어를 3갈래로 공격하기로 계획했었다.";"Японскія войскі планавалі атакаваць умацаванні амерыканскіх войскаў з трох бакоў пры падтрымцы артылерыі і авіяцыі.";"Forțele japoneze intenționau să atace apărarea americană din trei direcții, având sprijinul aerian și al artileriei.";"日\t軍\t計\t劃\t在\t空\t中\t和\t火\t炮\t的\t支\t援\t下，\t從\t三\t個\t方\t向\t進\t攻\t美\t國\t的\t防\t禦\t工\t事";"相\t关\t字\t幕\t内\t容，\t暂\t不\t开\t放\t展\t示";;
