"<ID|readonly|noverify>";"<English>";"<French>";"<Italian>";"<German>";"<Spanish>";"<Russian>";"<Polish>";"<Czech>";"<Turkish>";"<Chinese>";"<Japanese>";"<Portuguese>";"<Ukrainian>";"<Serbian>";"<Hungarian>";"<Korean>";"<Belarusian>";"<Romanian>";"<TChinese>";"<HChinese>";"<Comments>";"<max_chars>"
"mb/coS_2/objective";"Defend the Shōkaku carrier from U.S. air attacks with your group of four A6M2 Zero planes";"Défendez le porte-avions Shokaku des attaques aériennes américaines avec votre groupe de 4 avions Zéros A6M2";"Difendi la portaerei Shōkaku dagli attacchi aerei USA con il suo gruppo di 4 aerei A6M2 Zero";"Führe deine Staffel aus vier A6M2 Zero und verteidige den Träger Shōkaku gegen die US-Luftangriffe.";"Defienda al portaaviones Shōkaku de los ataques aéreos de los norteamericanos con su grupo de 4 aviones Zero A6M2";"С группой из 4 A6M2 Зеро защитите авианосец ""Сёкаку"" от атак американской авиации";"Wraz z grupą czterech samolotów A6M2 Zero chroń lotniskowiec Shōkaku przed amerykańskimi atakami z powietrza.";"Se svou skupinou čtyř letounů A6M2 Reisen braň letadlovou loď Šókaku před útoky amerických leetadel";"Shōkaku uçak gemisini dört A6M2 Zero uçağınla ABD hava saldırılarından koru.";"率\t四\t架\t零\t战\t二\t一\t型\t保\t护\t“翔\t鹤”\t号。";"A6M2零式戦闘機の\t飛行小隊\t4機を\t率いて、\t空母翔鶴への\t米軍の\t空襲を\t阻止せよ";"Defender o porta-aviões Shokaku dos ataques aéreos americanos com seu grupo de quatro aviões ""A6M2 Zero""";"Разом зі своєю групою з чотирьох A6M2 Zero, захистіть авіаносець Сьокаку від повітряної атаки США";"Odbrani nosača aviona Šokaku od američkih vazdušnih napada sa grupom od četiri aviona A6M2 Zero";"Vezesd a négy A6M2 típusú repülőgépből álló köteléked, és védd meg a Sókaku repülőgép-hordozót az amerikai támadásoktól.";"4대의 A6M2 제로기로 구성된 편대를 이끌고 미군의 공습으로부터 항공모함 쇼카쿠를 방어하라.";"У складзе групы з чатырох самалётаў A6M2 Zero абараніце авіяносец «Сёкаку» ад атак амерыканскай авіяцыі.";"Apără portavionul Shōkaku de atacurile aeriene americane cu grupul tău de patru avioane A6M2 Zero.";"在\t美\t國\t的\t空\t襲\t下，\t率\t領\t四\t架\t零\t戰\t二\t一\t型\t保\t護\t“翔\t鶴”\t號\t航\t母。";"相\t关\t字\t幕\t内\t容，\t暂\t不\t开\t放\t展\t示";;
"mb/coS_2/part1";"On May 7, 1942, a massive attack launched from American carriers Lexington and Yorktown destroyed light carrier Shoho, the leader of a group of ships heading towards Port Moresby.";"Le 7 mai 1942, une attaque énorme fut lancée des portes-avions américains Lexington et Yorktown détruisant le porte-avions léger Shoho, le meneur d’un groupe de bateaux se dirigeant vers Port Moresby.";"Il 7 maggio 1942, un attacco massivo lanciato dalle portaerei americane Lexington e Yorktown distrusse la portaerei leggera Shoho, la leader del gruppo di navi che si dirigevano a Port Moresby.";"Am 7. Mai 1942 wurde bei einem massiven, von den amerikanischen Flugzeugträgern Lexington und Yorktown aus gestarteten Angriff der leichte Träger Shōhō versenkt, der eine Gruppe von Schiffen anführte, die in Richtung Port Moresby unterwegs waren.";"El 7 de mayo de 1942, un ataque masivo lanzado desde los portaaviones norteamericanos Lexington y Yorktown destruyó al portaaviones ligero Shoho, el líder de un grupo de buques que se dirigía hacia Port Moresby.";"Седьмого мая 1942 года массированная атака, запущенная с американских авианосцев ""Лексингтон"" и ""Йорктаун"", уничтожила лёгкий авианосец ""Сёхо"", возглавлявший группу кораблей, следовавших к Порт-Морсби.";"7 maja 1942 roku w wyniku zmasowanego ataku przeprowadzonego przez amerykańskie lotniskowce Lexington i Yorktown zniszczony został lekki lotniskowiec Shoho, dowodzący grupą okrętów zmierzających do Port Moresby.";"7. května 1942 masivní nálet z amerických letadlových lodí Lexington a Yorktown zničil lehkou letadlovou loď Šóhó, velitelské plavidlo skupiny mířící k Port Moresby.";"7 Mayıs 1942'de Amerikan gemileri Lexington ve Yorktown'dan başlatılan büyük bir saldırı, hafif uçak gemisi Shoho'yu yok etti. Shoho, Moresby limanına doğru giden bir grup geminin lideriydi.";"1942 年 5 月 7 日，\t美\t国\t“列\t克\t星\t敦”\t号\t和\t“约\t克\t城”\t号\t发\t动\t大\t规\t模\t攻\t击，\t摧\t毁\t了\t“祥\t凤”\t号\t轻\t型\t航\t母\t—\t—\t驶\t向\t莫\t尔\t兹\t比\t港\t舰\t队\t的\t领\t舰。";"1942年五月七日、\tアメリカ\t軍空母\tレキシントンと\tヨークタウンによる\t大規模な\t攻撃により、\tポートモレスビー\t攻略部隊の\t主力艦、\t軽空母祥鳳が\t撃沈された。";"Em 7 de Maio de 1942, iniciou-se um intenso ataque aos porta-aviões americanos Lexington e o Yorktown que destruiu o porta-aviões leve Shoho, o líder de um grupo de navios, indo em direção ao Porto Moresby.";"7 травня 1942 року, широкомасштабна атака, розпочата американськими авіаносцями Лексінгтон та Йорктаун, потопила легкий авіаносець Сьохо, що очолював морське з’єднання, що направлялося до порту Моресбі.";"7. maja 1942, pokrenut je obiman napad sa američkih nosača Leksington i Jorktaun u kome je uništen laki nosač aviona Šoho, vođa grupe brodova koji plove prema Port Morsbiju.";"1942. május 7-én egy nagy erejű támadást indítottak az amerikai hordozók fedélzetéről, melynek eredményeképpen megsemmisült a Port Moresbybe tartó hajócsoport vezetője, a Sóhó könnyű repülőgép-hordozó.";"1942년 5월 7일 미국 항공모함 렉싱턴과 요크타운에서 발진한 대규모 공격대는 포트모르즈비로 향하는 함대의 기함인 경항공모함 쇼호를 격침시켰다.";"7 мая 1942 г. у выніку масіраванага налёту з амерыканскіх авіяносцаў «Лексінгтан» і «Ёрктаўн» быў знішчаны лёгкі авіяносец «Сёхо», які ўзначальваў групу караблёў, што рухаліся да Порт-Морсбі.";"La 7 mai 1942, un atac masiv lansat de portavioanele americane Lexington și Yorktown a distrus portavionul ușor Shōhō, liderul unui grup de nave ce se îndreptau spre Port Moresby.";"1942 年 5 月 7 日，\t美\t國\t“列\t星\t頓”\t號\t和\t“約\t克\t鎮”\t號\t發\t動\t大\t規\t模\t攻\t擊，\t摧\t毀\t了\t“祥\t鳳”\t號\t輕\t型\t航\t母\t—\t—\t駛\t向\t莫\t爾\t茲\t比\t港\t艦\t隊\t的\t領\t艦。";"相\t关\t字\t幕\t内\t容，\t暂\t不\t开\t放\t展\t示";;
"mb/coS_2/part2";"When Shoho was destroyed, the remaining ships from the group turned north. The ships heading towards Port Moresby were also forced to retreat.";"Lorsque Shoho fut détruit, les autres bateaux du groupe prirent la direction du nord. Les bateaux qui se dirigeaient vers Port Moresby durent aussi battre en retraite.";"Quando la Shoho fu distrutta, le altre navi del gruppo si diressero a nord. Anche le navi che si dirigevano a Port Moresby dovettero retrocedere.";"Als die Shōhō zerstört wurde, drehten die verbliebenen Schiffe nach Norden ab. Auch die anderen Schiffe mit Ziel Port Moresby mussten sich zurückziehen.";"Cuando destruyeron al Shoho, los buques restantes se dirigieron hacia el norte. Los buques que se dirigían a Port Moresby fueron obligados a retirarse.";"После уничтожения ""Сёхо"" оставшиеся корабли из группы повернули на север, и корабли, двигавшиеся в Порт-Морсби, также были вынуждены отступить.";"Gdy Shoho został zatopiony, pozostałe okręty z grupy skręciły na północ. Jednostki kierujące się na Port Moresby zostały zmuszone do odwrotu.";"Po zničení Šóhó se zbývající lodě skupiny stočily k severu. Ke stažení byly přinuceny i lodě mířící k Port Moresby.";"Shoho yok edilince, gruptaki kalan gemiler kuzeye döndü. Moresby'ye giden gemiler de geri çekilmeye zorlandı.";"“祥\t凤”\t号\t被\t摧\t毁\t后，\t舰\t队\t不\t得\t不\t改\t道\t向\t北。\t而\t驶\t向\t莫\t尔\t兹\t比\t港\t的\t船\t只\t也\t被\t迫\t撤\t离。";"祥鳳の\t撃沈に\t伴い、\t残存艦艇は\t転進して\t北上　\tポートモレスビーを\t目指していた\t艦隊も\t退却を\t余儀なくされた";"Quando Shoho foi destruído, os navios restantes do grupo rumaram a norte. Os navios que estavam indo em direção ao Porto Moresby também foram forçados a recuar.";"Коли Сьохо потопили, кораблі, що залишилися звернули на північ. Кораблі, які пливли до порту Моресбі також змушену біли відступити.";"Kada je Šoho uništen, preostali brodovi iz flote okrenuli su ka severu. Brodovi koji su išli ka Port Morsbiju, takođe su bili primorani da se povuku.";"Amikor a Sóhó elsüllyedt, a megmaradt hajók északnak fordultak, valamint a Port Moresbybe tartó hajók is visszavonulásra kényszerültek.";"쇼호가 격침되었을 때, 남아있던 함선들은 북쪽을 향했다. 포트모르즈비로 향하던 함선들 역시 후퇴할 수밖에 없었다.";"Пасля знішчэння авіяносца «Сёхо» астатнія караблі групы павярнулі на поўнач. Таксама былі вымушаны адступіць і караблі, што накіроўваліся на Порт-Морсбі.";"Când Shōhō a fost distrus, restul navelor din grup s-au îndreptat spre nord. Navele ce se îndreptau către Port Moresby au fost și ele forțate să se retragă.";"“祥\t鳳”\t號\t被\t摧\t毀\t後，\t艦\t隊\t不\t得\t不\t改\t道\t向\t北。\t而\t駛\t向\t莫\t爾\t茲\t比\t港\t的\t船\t隻\t也\t被\t迫\t撤\t離。";"相\t关\t字\t幕\t内\t容，\t暂\t不\t开\t放\t展\t示";;
"mb/coS_2/part3";"Lexington and Yorktown continued their search for the Japanese fleet.";"Lexington et Yorktown poursuivirent leurs recherches de la flotte japonaise.";"La Lexington e la Yorktown continuarono a cercare la flotta giapponese.";"Die Lexington und die Yorktown setzten ihre Suche nach der japanischen Flotte fort.";"El Lexington y el Yorktown continuaron la búsqueda de la flota japonesa.";"Лексингтон"" и ""Йорктаун"" продолжали поиски японского флота.";"Lexington i Yorktown kontynuowały poszukiwania floty japońskiej.";"Lexington a Yorktown pokračovaly v hledání japonské flotily.";"Lexington ve Yorktown, Japon filosunu aramaya devam etti.";"“列\t克\t星\t敦”\t号\t和\t“约\t克\t城”\t号\t继\t续\t搜\t寻\t着\t日\t本\t舰\t队。";"レキシントンと\tヨークタウンは、\t日本軍艦隊の\t捜索を\t続けた";"Lexington e o Yorktown continuaram a sua busca pela frota japonesa.";"Лексінгтон та Йорктаун продовжили свої пошуки японського флоту.";"Leksington i Jorktaun nastavljaju sa potragom za japanskom flotom.";"A Lexington és Yorktown folytatta a japán flotta keresését.";"렉싱턴과 요크타운은 일본 함대에 대한 수색을 계속했다.";"«Лексінгтан» і «Ёрктаўн» працягвалі пошукі японскага флоту.";"Lexington și Yorktown și-au continuat căutările pentru flota japoneză.";"“列\t星\t頓”\t號\t及\t“約\t克\t鎮”\t號\t繼\t續\t搜\t尋\t著\t日\t本\t艦\t隊。";"相\t关\t字\t幕\t内\t容，\t暂\t不\t开\t放\t展\t示";;
"mb/coS_2/part4";"Meanwhile, two Japanese carriers Shōkaku and Zuikaku sailed around Solomon Islands and headed towards Port Moresby.";"Pendant ce temps, deux porte-avions japonais, Shokaku et Zuikaku, contournaient les îles Salomon et se dirigeaient vers Port Moresby.";"Nel frattempo, due portaerei giapponesi, la Shōkaku e la Zuikaku, aggirarono le Isole Salomone per dirigersi a Port Moresby.";"Währenddessen umrundeten die japanischen Flugzeugträger Shōkaku und Zuikaku die Solomonen und nahmen Kurs auf Port Moresby.";"Mientras tanto dos portaaviones japoneses, Shōkaku y Zuikaku, navegaban bordeando las islas Salomón y se dirigían hacia Port Moresby.";"В это время два японских авианосца, ""Сёкаку"" и ""Дзуйкаку"", обогнув Соломоновы острова, направились в сторону Порт-Морсби.";"W tym czasie dwa japońskie lotniskowce, Shōkaku i Zuikaku, popłynęły wokół Wysp Salomona i zmierzały do Port Moresby.";"Mezitím dvě japonské letadlové lodě, Šókaku a Zuikaku, obepluly Šalamounovy ostrovy a vydaly se směrem k Port Moresby.";"Bu arada iki Japon gemisi Shōkaku ve Zuikaku, Solomon Adaları etrafından dolaşıp Moresby'ye doğru yöneldi.";"与\t此\t同\t时，\t“翔\t鹤”\t号\t和\t“瑞\t鹤”\t号\t绕\t过\t了\t所\t罗\t门\t群\t岛，\t正\t朝\t莫\t尔\t兹\t比\t港\t驶\t去。";"同時に\t帝国海軍空母「翔鶴」\tと「瑞鶴」\tは\tソロモン\t諸島を\t迂回し、\tポートモレスビーへと\t向かっていた。";"Enquanto isso, dois porta-aviões japoneses Shokaku e Zuikaku navegaram ao redor das Ilhas Salomão e em direção à Port Moresby.";"Тим часом, два японські авіаносці Сьокаку та Дзуйкаку оминули Соломонові острови та попрямували до порту Моресбі.";"U međuvremenu, dva japanska nosača Šokaku i Zuikaku zaplovila su oko Solomonskih ostrva zaputivši se ka Port Morsbiju.";"Eközben két japán repülőgép-hordozó, a Sóhó és a Zuikaku hajózott a Salamon-szigetek körül, majd indultak el Port Moresby felé.";"한편 일본의 쇼카쿠와 즈이카쿠는 솔로몬 제도 인근을 항해하고 포트모르즈비 쪽으로 향했다.";"У гэты час два японскія авіяносцы, «Сёкаку» і «Дзуйкаку», абышлі Саламонавы астравы і накіраваліся ў кірунку Порт-Морсбі.";"Între timp, două portavioane japoneze, Shōkaku și Zuikaku, au navigat în jurul Insulelor Solomon și s-au îndreptat spre Port Moresby.";"此\t時，\t兩\t艘\t日\t本\t航\t母\t“翔\t鶴”\t號\t和\t“瑞\t鶴”\t號\t在\t所\t羅\t門\t群\t島\t附\t近\t航\t行，\t朝\t摩\t斯\t比\t港\t口\t前\t進。";"相\t关\t字\t幕\t内\t容，\t暂\t不\t开\t放\t展\t示";;
"mb/coS_2/part5";"On the morning of May 8, the Americans detected the Japanese fleet and launched an air strike from both carriers.";"Le matin du 8 mai, les Américains repérèrent la flotte japonaise et lancèrent une attaque aérienne de leurs deux porte-avions.";"La mattina dell' 8 maggio, gli Americani notarono la flotta giapponese e lanciarono un attacco aereo da entrambe le portaerei.";"Am Morgen des 8. Mai entdeckten die Amerikaner die japanische Flotte und starteten mit beiden Flugzeugträgern einen Luftangriff.";"En la mañana del 8 de mayo, los norteamericanos detectaron a la flota japonesa y lanzaron un ataque aéreo desde ambos portaaviones.";"Утром 8 мая американцы заметили японский флот и отправили самолёты с обоих авианосцев в атаку.";"Rankiem 8 maja Amerykanie zlokalizowali flotę japońską i przypuścili atak powietrzny z obu lotniskowców.";"Ráno 8. května Američané našli japonskou flotilu a vyslali stroje z obou letadlových lodí.";"8 Mayıs sabahı Amerikalılar Japon filosunu tespit etti ve her iki gemiden de hava saldırısı başlattı.";"5 月 8 日\t早\t上，\t美\t军\t侦\t察\t到\t了\t日\t本\t舰\t队。\t“列\t克\t星\t敦”\t号\t和\t约\t克\t城\t好\t立\t即\t派\t出\t了\t攻\t击\t波\t次。";"五月八日の\t朝、\tアメリカ\t軍は\t日本軍艦隊を\t発見し、\t両空母に\t航空攻撃を\t仕掛けた";"Na manhã de 8 de Maio, os americanos detectaram a frota japonesa e iniciaram um ataque aéreo de ambos os porta-aviões.";"На ранок 8 травня, американці виявили японський флот та розпочали повітряну атаку одразу з двох авіаносців.";"Ujutru 8. maja, Amerikanci otkrivaju japansku flotu i pokreću vazdušni napad sa oba nosača aviona.";"Május 8 reggelén az amerikaiak észrevették a japán flottát, és légicsapást indítottak mindkét repülőgép-hordozóról.";"5월 8일 아침, 미군은 일본군 함대를 발견하였고 양 항공모함에서 함재기를 발진시켜 공습을 시작했다.";"Раніцай 8 мая амерыканцы заўважылі японскі флот і адправілі самалёты з абодвух авіяносцаў у атаку.";"În dimineața zilei de 8 mai, americanii au detectat flota japoneză și au lansat o lovitură aeriană de pe ambele portavioane.";"5 月 8 日\t早\t上，\t美\t軍\t偵\t查\t到\t了\t日\t本\t艦\t隊。 “列\t星\t頓”\t號\t和\t“約\t克\t鎮”\t號\t立\t即\t派\t出\t飛\t機\t空\t襲。";"相\t关\t字\t幕\t内\t容，\t暂\t不\t开\t放\t展\t示";;
"mb/coS_2/part6";"The Japanese noticed the planes approaching Shōkaku and Zuikaku and prepared to face the attackers.";"Les Japonais virent les avions qui s'approchaient de Shokaku et Zuikaki et se préparèrent à faire face à leurs attaquants.";"I Giapponesi notarono gli aerei che si avvicinavano alla Shōkaku e alla Zuikaku e si prepararono allo scontro.";"Die Japaner bemerkten den Anflug des Feindes auf die Shokaku und Zuikaki und bereiten sich auf die Verteidigung vor.";"Los japoneses detectaron a los aviones que se aproximaban al Shōkaku y al Zuikaku y se prepararon para enfrentarse a los atacantes.";"Японцы, заметившие приближающуюся к ""Сёкаку"" и ""Дзуйкаку"" армаду, приготовились встретить нападающих.";"Japończycy wykryli samoloty zbliżające się do Shōkaku oraz Zuikaku i przygotowali się do obrony.";"Japonci si všimli letadel mířících k Šókaku a Zuikaku a připravili se k obraně.";"Japonlar Shōkaku ve Zuikaki'ye yaklaşan uçakları fark edip saldırıyla yüzleşmeye hazırlandı.";"日\t军\t发\t现\t了\t来\t袭\t的\t美\t国\t飞\t机，\t已\t做\t好\t应\t战\t准\t备。";"日本側は「翔鶴」\t「瑞鶴」\tに\t接近する\t機影を\t認め、\t敵機を\t迎え\t撃つ\t準備を\t始める。";"Os japoneses alertaram os aviões chegando a Shōkaku e Zuikaku e prepararam-se para enfrentar os inimigos.";"Японці помітили наближення літаків до Сьокаку та Дзуйкаку та приготувалися до бою.";"Japanci primećuju avione koji se približavaju nosaču Šokaku i Zuikaku i spremaju se za suprotstavljanje napadačima.";"A japánok észlelték a Sókaku és a Zuikaku felé tartó repülőgépeket, és felkészültek a támadásra.";"일본군은 쇼카쿠와 즈이카쿠에 접근중인 항공기를 발견하고 적을 맞을 준비를 했다.";"Японцы, заўважыўшы набліжэнне да «Сёкаку» і «Дзуйкаку» варожай авіяцыі, падрыхтаваліся да абароны.";"Japonezii au observat avioanele ce se apropiau de Shōkaku și Zuikaku și s-au pregătit să înfrunte atacatorii.";"日\t軍\t發\t現\t了\t往\t“翔\t鶴”\t號\t“和\t瑞\t鶴”\t號\t航\t母\t來\t襲\t的\t美\t國\t飛\t機，\t已\t做\t好\t應\t戰\t準\t備。";"相\t关\t字\t幕\t内\t容，\t暂\t不\t开\t放\t展\t示";;
"mb/coS_3/place";"IJN Shōkaku, Task Force MO, Carrier Striking Force, Fifth Carrier Division";"IJN Shokaku, Task Force MO, porte-avions d’attaque, Cinquième Division de porte-avions";"IJN Shōkaku, Task Force MO, Forza d'Attacco di Portaerei, Quinta Divisione Portaerei";"IJN Shōkaku, MO Einsatzkommando, Marineluftflotte, Trägerdivision 5";"IJN Shōkaku, Task Force MO, Fuerza de Ataque de Portaaviones, Quinta División de Portaaviones";"Авианосец ""Сёкаку"", Оперативная Группа МО, Авианосное Ударное Соединение, Пятое Авианосное Подразделение";"Lotniskowiec Shōkaku, Zespół Operacyjny MO, Zespół Uderzeniowy Lotniskowców, 5 Dywizjon Lotniskowców";"IJN Šókaku, operační svaz MO, úderný svaz letadlových lodí, pátá divize letadlových lodí";"IJN Shōkaku, MO Görev Gücü, Uçak Gemisi Saldırı Gücü, 5. Uçak Gemisi Bölüğü";"日\t本\t“MO”\t机\t动\t部\t队\t（第\t一\t航\t空\t舰\t队\t第\t五\t航\t空\t战\t队），\t“翔\t鹤”\t号\t航\t空\t母\t舰";"大日本帝国海軍空母\tMO\t機動部隊第\t1機動部隊第五航空戦隊翔鶴";"MIJ Shōkaku, Força-tarefa MO, Porta-aviões Striking Force, Quinta Divisão de Porta-aviões";"Авіаносець Сьокаку, Оперативна група МО, Авіаносна Ударна Група, П'ята Авіаносна Дивізія";"IJN Šokaku, Operativna grupa MO, Udarna grupa nosača aviona, Peta divizija nosača aviona";"Sókaku repülőgép-hordozó, MO alkalmi harci kötelék, csapásmérő hordozóegység, 5. repülőgép-hordozó hadosztály";"일본 해군 ""MO 기동부대"" 항모기동부대 제5전대 소속 항공모함 즈이카쿠";"Авіяносец «Сёкаку», аператыўная група «MO», Авіяноснае ўдарнае злучэнне, Пятае авіяноснае падраздзяленне";"Shōkaku, MIJ, Forța Operațională MO, forța de portavioane de atac, divizia a cincea de portavioane.";"日\t本\t帝\t國\t海\t軍\t“MO”\t機\t動\t部\t隊\t（五\t航\t戰），\t“翔\t鶴”\t號\t航\t空\t母\t艦";"相\t关\t字\t幕\t内\t容，\t暂\t不\t开\t放\t展\t示";;
"mb/coS_3/date";"10:53 May 8, 1942";"10 h 53 – 8 Mai 1942";"10:53:00 del 08.05.42";"10:53 Uhr, 8. Mai 1942";"10:53hs, 8 de mayo de 1942";"10:53, 8 мая 1942";"10:35, 8 maja 1942 roku";"8. května 1942, 10:53";"10:53 8 Mayıs 1942";"1942 年 5 月 8 日，\t10 时 53 分";"1942年\t5月\t8日、\t10:53";"8 De Maio de 1942 às 10:53";"10:53, 8 травня 1942 року";"10:53 Maj 8, 1942";"1942. május 8., 10:53";"1942년 5월 8일 10:53";"10:53, 8 мая 1942 года";"10:53 8 mai 1942";"1942 年 5 月 8 日，\t10 時 53 分";"相\t关\t字\t幕\t内\t容，\t暂\t不\t开\t放\t展\t示";;
